<?xml version="1.0" encoding="UTF-8"?>
<!DOCTYPE properties SYSTEM "cpf.dtd">
<properties>
<simple name="Import" type="string"><value>/install/build-trunk-lxrt/lib</value></simple>

<struct name="nAxesControllerPos" type="OCL::nAxesControllerPos">
  <struct name="Activity" type="PeriodicActivity">
    <simple name="Period" type="double"><value>0.01</value></simple>
    <simple name="Priority" type="short"><value>0</value></simple>
    <simple name="Scheduler" type="string"><value>ORO_SCHED_RT</value></simple>
  </struct>
  <simple name="AutoConf" type="boolean"><value>1</value></simple>
  <simple name="AutoStart" type="boolean"><value>0</value></simple>
  <simple name="PropertyFile" type="string"><value>cpf/nAxesControllerPos.cpf</value></simple>
  <struct name="Ports" type="PropertyBag">
     <simple name="nAxesSensorPosition" type="string"><value>nAxesSensorPosition</value></simple>
     <simple name="nAxesDesiredPosition" type="string"><value>nAxesDesiredPosition</value></simple>
     <simple name="nAxesOutputVelocity" type="string"><value>nAxesOutputVelocity</value></simple>
  </struct>
</struct>

<struct name="nAxesControllerPosVel" type="OCL::nAxesControllerPosVel">
  <struct name="Activity" type="PeriodicActivity">
    <simple name="Period" type="double"><value>0.01</value></simple>
    <simple name="Priority" type="short"><value>0</value></simple>
    <simple name="Scheduler" type="string"><value>ORO_SCHED_RT</value></simple>
  </struct>
  <simple name="AutoConf" type="boolean"><value>1</value></simple>
  <simple name="AutoStart" type="boolean"><value>0</value></simple>
  <simple name="PropertyFile" type="string"><value>cpf/nAxesControllerPosVel.cpf</value></simple>
  <struct name="Ports" type="PropertyBag">
     <simple name="nAxesSensorPosition" type="string"><value>nAxesSensorPosition</value></simple>
     <simple name="nAxesDesiredPosition" type="string"><value>nAxesDesiredPosition</value></simple>
     <simple name="nAxesDesiredVelocity" type="string"><value>nAxesDesiredVelocity</value></simple>
     <simple name="nAxesOutputVelocity" type="string"><value>nAxesOutputVelocity</value></simple>
  </struct>
</struct>

<struct name="nAxesControllerVel" type="OCL::nAxesControllerVel">
  <struct name="Activity" type="PeriodicActivity">
    <simple name="Period" type="double"><value>0.01</value></simple>
    <simple name="Priority" type="short"><value>0</value></simple>
    <simple name="Scheduler" type="string"><value>ORO_SCHED_RT</value></simple>
  </struct>
  <simple name="AutoConf" type="boolean"><value>1</value></simple>
  <simple name="AutoStart" type="boolean"><value>0</value></simple>
  <simple name="PropertyFile" type="string"><value>cpf/nAxesControllerVel.cpf</value></simple>
  <struct name="Ports" type="PropertyBag">
     <simple name="nAxesSensorPosition" type="string"><value>nAxesSensorPosition</value></simple>
     <simple name="nAxesDesiredVelocity" type="string"><value>nAxesDesiredVelocity</value></simple>
     <simple name="nAxesOutputVelocity" type="string"><value>nAxesOutputVelocity</value></simple>
  </struct>
</struct>

<struct name="nAxesGeneratorPos" type="OCL::nAxesGeneratorPos">
  <struct name="Activity" type="PeriodicActivity">
    <simple name="Period" type="double"><value>0.01</value></simple>
    <simple name="Priority" type="short"><value>0</value></simple>
    <simple name="Scheduler" type="string"><value>ORO_SCHED_RT</value></simple>
  </struct>
  <simple name="AutoConf" type="boolean"><value>1</value></simple>
  <simple name="AutoStart" type="boolean"><value>0</value></simple>
  <simple name="PropertyFile" type="string"><value>cpf/nAxesGeneratorPos.cpf</value></simple>
  <struct name="Ports" type="PropertyBag">
     <simple name="nAxesSensorPosition" type="string"><value>nAxesSensorPosition</value></simple>
     <simple name="nAxesDesiredVelocity" type="string"><value>nAxesDesiredVelocity</value></simple>
     <simple name="nAxesDesiredPosition" type="string"><value>nAxesDesiredPosition</value></simple>
  </struct>
</struct>


<struct name="Robot" type="OCL::nAxesVelocityController">
  <struct name="Activity" type="PeriodicActivity">
    <simple name="Period" type="double"><value>0.001</value></simple>
    <simple name="Priority" type="short"><value>0</value></simple>
    <simple name="Scheduler" type="string"><value>ORO_SCHED_RT</value></simple>
  </struct> 
  <simple name="AutoConf" type="boolean"><value>1</value></simple>
  <simple name="AutoStart" type="boolean"><value>1</value></simple>
  <simple name="PropertyFile" type="string"><value>cpf/nAxesVelocityController.cpf</value></simple>
  <struct name="Ports" type="PropertyBag">
     <simple name="nAxesSensorPosition" type="string"><value>nAxesSensorPosition</value></simple>
     <simple name="nAxesSensorVelocity" type="string"><value>nAxesSensorVelocity</value></simple>
     <simple name="nAxesOutputValue" type="string"><value>nAxesOutputVelocity</value></simple>
  </struct>
</struct>
</properties>
