<?xml version="1.0" encoding="UTF-8"?>
<!DOCTYPE properties SYSTEM "cpf.dtd">
<properties>

	<simple name="Import" type="string"><value>rtt_rosnode</value></simple>
	<simple name="Import" type="string"><value>ocl</value></simple>
	<simple name="Import" type="string"><value>naxes_motion_control</value></simple>
	<simple name="Import" type="string"><value>lwr_fri</value></simple>
	<simple name="Import" type="string"><value>basic_moves</value></simple>

	<struct name="FRIServer" type="lwr_fri::FRIComponent">
		<struct name="Activity" type="NonPeriodicActivity">
			<simple name="Priority" type="long"><value>1</value></simple>
			<simple name="Scheduler" type="string"><value>ORO_SCHED_RT</value></simple>
		</struct>
		<simple name="AutoConf" type="boolean"><value>1</value></simple>
		<simple name="AutoStart" type="boolean"><value>1</value></simple>
		<simple name="LoadProperties" 
type="string"><value>../kuka_robot_hardware/lwr_fri/example/cpf/FRIServer.cpf</value></simple>
		<struct name="Ports" type="PropertyBag">
			<simple name="JointState" type="string"><value>JntPosMsr</value></simple>
			<simple name="JointPositionCommand" type="string"><value>JntPosDsr</value></simple>
			<simple name="CartesianPosition" type="string"><value>CartPos</value></simple>
			<simple name="FRIState" type="string"><value>FRIState</value></simple>
			<simple name="RobotState" type="string"><value>RobotState</value></simple>
		</struct>
	</struct>

	<struct name="nAxesGeneratorPos" type="MotionControl::nAxesGeneratorPos">
		<struct name="Activity" type="PeriodicActivity">
			<simple name="Period" type="double"><value>0.01</value></simple>
			<simple name="Priority" type="long"><value>1</value></simple>
			<simple name="Scheduler" type="string"><value>ORO_SCHED_RT</value></simple>
		</struct>
		<simple name="AutoConf" type="boolean"><value>1</value></simple>
		<simple name="AutoStart" type="boolean"><value>1</value></simple>
		<simple name="PropertyFile" 
type="string"><value>../kuka_robot_hardware/lwr_fri/example/cpf/nAxesGeneratorPosT2.cpf</value></simple>
		<struct name="Ports" type="PropertyBag">
			<simple name="nAxesSensorPosition" type="string"><value>JntPosMsr</value></simple>
			<simple name="nAxesDesiredPosition" type="string"><value>JntPosDsr</value></simple>
			<simple name="events" type="string"><value>AxesEvents</value></simple>
		</struct>
	</struct>

	<struct name="BasicMoves" type="iros::Basic_moves">
		<struct name="Activity" type="NonPeriodicActivity">
			<simple name="Priority" type="long"><value>1</value></simple>
			<simple name="Scheduler" type="string"><value>ORO_SCHED_RT</value></simple>
		</struct>
		<simple name="AutoConf" type="boolean"><value>1</value></simple>
		<simple name="AutoStart" type="boolean"><value>1</value></simple>
		<!--<simple name="LoadProperties" type="string"><value>cpf/FRIServer.cpf</value></simple>-->
		<struct name="Ports" type="PropertyBag">
			<simple name="JointsPort" type="string"><value>JntPosMsr</value></simple>
			<simple name="PosePort" type="string"><value>CartPos</value></simple>
			<simple name="AxesEventPort" type="string"><value>AxesEvents</value></simple>
			<simple name="FRIState" type="string"><value>FRIState</value></simple>
			<simple name="RobotState" type="string"><value>RobotState</value></simple>
		</struct>
		<struct name="Peers" type="PropertyBag">
			<simple name="Peer" type="string"><value>nAxesGeneratorPos</value></simple>
		</struct>
	</struct>


	<!--<struct name="Reporter" type="OCL::FileReporting"> 
		<struct name="Activity" type="PeriodicActivity"> 
			<simple name="Period" type="double"><value>0.04</value></simple> 
			<simple name="Priority" type="short"><value>1</value></simple> 
			<simple name="Scheduler" type="string"><value>ORO_SCHED_OTHER</value></simple>
		</struct>
		<simple name="AutoConf" type="boolean"><value>1</value></simple>
		<simple name="AutoStart" type="boolean"><value>1</value></simple>
		<simple name="AutoSave" type="boolean"><value>0</value></simple>
		<simple name="LoadProperties" type="string"><value>cpf/reporter_naxes.cpf</value></simple>
		<struct name="Peers" type="PropertyBag">
			<simple name="Peer" type="string"><value>FRIServer</value></simple>
			<simple name="Peer" type="string"><value>nAxesGeneratorPos</value></simple>
		</struct>
	</struct>-->

</properties>
